,Question,Answer
0,"In March 2014, Sweden had a change in its Consumer Price Index of –0.6%.  Which combination of policies might the government use to restore price stability? 

A. increase interest rates and increase indirect taxes 
B. increase interest rates and reduce government expenditure 
C. reduce government spending and increase income tax
D. reduce interest rates and increase government expenditure ",D
1,"Possible policies a government might use to reduce a deficit on the current account of the balance of payments include devaluation, government spending cuts, interest rate rises and tariffs on imports.  Which two policies would be classified as expenditure-switching? 

A. devaluation and government spending cuts
B. government spending cuts and interest rate rises 
C. interest rate rises and tariffs on imports 
D. tariffs on imports and devaluation ",D
2,"What would be increased by an expansionary fiscal policy? 

A. budget deficit 
B. exchange rate 
C. money supply 
D. rate of direct taxation ",A
3,"A government removes the tariff on a product as shown in the diagram.   What will be the change in domestic production? 

A. a reduction of WV 
B. a reduction of XV 
C. a reduction of XW  
D. a reduction of ZY ",A
4,"A country’s terms of trade increased from a base year value of 100 to 120 in the following year.   If export prices had increased by 50%, what was the change in the price of the country’s imports? 

A. –30%
B. –25% 
C. +25% 
D. +30% ",C
5,"At present, one unit of a country’s currency exchanges for US$1.20. The country aims to set its exchange rate at US$1.00.  Which combination of government actions in the foreign exchange market must achieve this aim? 

A. buying US currency and buying its own currency 
B. buying US currency and selling its own currency 
C. selling US currency and buying its own currency 
D. selling US currency and selling its own currency ",B
6,"What would identify a country with a fundamental balance of payments disequilibrium? 

A. alternate annual deficits and surpluses in the current account 
B. a continually growing balancing item 
C. a large short-term outflow of foreign direct investment 
D. a persistent rise in foreign currency reserves ",D
7,"What always happens when there is an increase in the Consumer Price Index?  

A. an increase in consumer expenditure 
B. an increase in the cost of living 
C. a reduction in living standards 
D. a reduction in real disposable income ",B
8,"On 1 May 2012 President Morales of Bolivia announced the nationalisation of Transportadora de Electricidad (TDE), a subsidiary of a Spanish company that owned and ran approximately three-quarters of Bolivia's power grid. What can be concluded from this?

A. Bolivian employees of TDE will own 100% of its shares.
B. Only Bolivian nationals will be allowed to work at TDE.
C. TDE company shares will be sold to a Bolivian company.
D. The Bolivian government will take over ownership of TDE.",D
9,"Which statement best describes a transfer payment?

A. It is a loan from the government to help firms.
B. It is a payment to individuals not linked to economic activity.
C. It is the redistribution of income from government to individuals for work done.
D. It is the redistribution of income from households to firms for goods purchased. ",B
10,"A government pays a subsidy to a country's onion producers. With which price elasticity of demand (PED) will this action be most effective in reducing the price of onions?

A. PED equals 0.
B. PED is greater than 0 but less than 1.
C. PED equals 1.
D. PED is greater than 1 but less than infinity. ",A
11,"A product with infinite elasticity of supply has sales of 1000 units a week at a price of $1 per unit. Price elasticity of demand is 1.5 over the relevant range. The government imposes a tax of 10%. What will be the government's weekly tax revenue?

A. $15
B. $85
C. $100
D. $150",B
12,"The diagram shows the market supply and demand curves for wheat.   What should a government do to maintain a minimum price of OP2? 

A. buy quantity KL
B. buy quantity KR
C. sell quantity LR
D. sell quantity KR",B
13,"A specific tax is placed upon each bottle of perfume sold. In the diagram, SS is the supply curve before tax, StSt is the supply curve after tax.  Which area represents that part of the tax revenue paid by consumers?

A. ORWY
B. PQUT
C. PRWT
D. QRWU",D
14,"In the diagram shown, D1 and S1 are the initial demand and supply curves for the US car market.  What will cause the demand curve for cars to shift to D2 and the supply curve for cars to shiftto S2?

A. a fall in real income and an increase in a unit tax on cars
B. a fall in unemployment and the removal of subsidies from the car industry
C. a rise in the price of bus fares and a fall in the cost of production of the car industry
D. a rise in the price of petrol and a fall in the number of firms in the car market ",C
15,"The price elasticity of supply of an 'App' for a phone is perfectly elastic. The current selling price for the 'App' is $10 and 200 'Apps' are sold per day. The 'App' becomes more popular and, as a result, demand increases by 50% at every price. What will be the outcome of the change in demand?

A. The price increases by 50% and the firm's revenue increases by 50%.
B. The price increases by less than 50% and the firm's revenue increases by less than 50%.
C. The price stays the same and the firm's revenue increases by 50%.
D. The price stays the same and the firm's revenue increases by an infinite amount.",C
16,"Public transport has an income elasticity of demand of –0.36. What does this mean about public transport?

A. It has close substitutes.
B. It is a necessity.
C. It is a normal good.
D. It is an inferior good. ",D
17,"A manufacturer progressively reduces the price of his product in an attempt to increase total revenue. The table shows the outcome of this policy. What is the price elasticity of demand for the product?

A. perfectly inelastic
B. relatively inelastic
C. perfectly elastic
D. unitary",D
18,"There are two main types of coffee grown, arabica and robusta. The table gives details of the four largest coffee producers for 2013-2014. Production is measured in thousand 60 kilogram bags. What can be concluded from the table about production in the four countries?

A. Brazil has the highest level of specialisation.
B. Brazil produces more coffee than the other three named producers together.
C. Robusta coffee production is greater than arabica coffee production.
D. Vietnam has a comparative advantage in robusta and Colombia in arabica.  ",B
19,"In calculating the short-run supply schedule for a firm, what is assumed to remain unchanged?

A. the number of consumers
B. the price of the good
C. the quantities of all factors
D. the state of technology ",D
20,"A production possibility curve shows labour-intensive farming output and capital-intensive manufacturing output. What would not cause a shift in this curve?

A. a reduction in sales tax on manufactured products
B. better training of workers in the manufacturing sector of the economy
C. improvements in the productivity of agricultural machinery
D. the reclamation of land to be used for both agriculture and manufacturing ",A
21,"The diagram shows the production possibility curves of two economies, X and Y.   Which statement about the two economies is correct?

A. Both economies always have identical opportunity costs.
B. Both economies have the same future growth prospects.
C. The opportunity costs are constant in each economy.
D. The terms of trade for both countries will be one capital good for one consumer good.",C
22,"The transition of centrally planned economies to market economies was accompanied by a significant change in the composition of output. What was an immediate consequence of this transition?

A. a build-up of unsold stocks of goods
B. an increase in exports of goods
C. an increase in structural unemployment
D. decreasing prices of goods and services ",C
23,"A driver makes the following estimates in considering the purchase of a car which she intends to use only when she would otherwise have used public transport. What will be the opportunity cost in monetary terms to the driver over the year of travelling by car rather than by public transport?  

A. $1500
B. $3000
C. $3700
D. $7800",B
24,"The production possibility curve for an economy producing capital and consumer goods is represented by the line PQ.  What is the opportunity cost of producing OS of consumer goods?

A. OR of capital goods
B. PR of capital goods
C. SQ of consumer goods
D. SQ of consumer goods + PR of capital goods",B
25,"The diagram shows an economy’s Lorenz curve (VW).   How is the Gini coefficient for the economy calculated? 

A. 
B. 
C. 
D. ",A
26,"What is most likely to result from foreign direct investment in a developing economy?

A. an improvement in the developing economy’s trade balance
B. an increase in the developing economy’s net investment income
C. a reduction in the developing economy’s government tax revenue
D. a reduction in wage levels in the developing economy",A
27,"During a year, a country’s national income in money terms increased by 5%, prices increased by 4% and the total population increased by 2%. What was the approximate change in real income per head?

A. a decrease of 1%
B. a decrease of 2%
C. an increase of 1%
D. an increase of 2%",A
28,"A government wants to reduce the current account deficit on the balance of payments.   What is an example of an expenditure-reducing policy?

A. a devaluation of the currency
B. a subsidy on domestic production
C. a tariff on imports
D. an increase in income taxes",D
29,"The optimum level of population is deemed to be that level at which real output per head is maximised.  The diagram shows the relationship between population size and output per head in a country for two different time periods.   Which change could not satisfactorily explain the shift from year 1 to year 2?

A. Population has increased.
B. State of technology has improved.
C. Stock of capital has increased.
D. Volume of productive resources in use has increased.",A
30,"Monetary policy does not usually work immediately.  Which time lag is likely to be the least concern to a government whose priority is a rapid domestic impact?

A. the time it takes for policymakers to recognise the cause of a problem
B. the time it takes for the economy to respond to the introduction of the policy
C. the time it takes for the foreign exchange rate to respond to the effect of the policy
D. the time it takes to put the chosen policy measure into place",C
31,"An economy experiences falling incomes and rising unemployment. The central bank decides to reduce the rate of interest to stimulate economic activity. When would such a policy be most likely to succeed?

A. when spending by consumers on goods and services is income elastic
B. when spending by firms on capital goods is interest rate elastic
C. when the leakage on additional national income is high
D. when the overseas demand for exports is price inelastic",B
32,"What is the most likely result of a period of negative actual growth?

A. an increase in the surplus of the financial account of the balance of payments
B. an increase in the deficit of the current account of the balance of payments
C. an increase in the rate of inflation
D. an increase in the rate of unemployment  ",D
33,"The diagram shows a curve representing the relationship between a country’s unemployment rate and its inflation rate.  Why is it likely that this curve only applies in the short run?

A. Any attempt to reduce unemployment will increase inflation.
B. Increased inflation actually increases unemployment.
C. Increased inflation leads to expectations of further inflation.
D. Increased inflation reduces real wage rates, which increases the demand for labour. ",C
34,"How would decreasing interest rates be most likely to reduce unemployment? 

A. by decreasing the borrowing costs of business
B. by decreasing the government’s budget deficit
C. by increasing the foreign exchange rate of the currency
D. by increasing the opportunity cost of spending",A
35,"A government decides to cut the rate of interest in order to stimulate aggregate demand and increase employment. Why might this policy not work in a recession?

A. Business confidence is low.
B. It leads to deflation.
C. It leads to an appreciation in the exchange rate.
D. It leads to a decrease in the money supply.",A
36,"A website compares the prices of groceries.  Which function of money is illustrated by this?

A. medium of exchange
B. standard of deferred payment
C. store of value
D. unit of account ",D
37,"A firm buys new machinery which increases the marginal productivity of its workforce. What will be the resulting impact on the market for labour?

A. a shift to the left in the demand curve for labour
B. a shift to the right in the demand curve for labour
C. a shift to the left in the supply curve of labour
D. a shift to the right in the supply curve of labour",B
38,"The diagram shows the supply of and the demand for workers in the car manufacturing industry.  A trade union successfully negotiates a wage increase from W1 to W2.   What is the likely impact on the level of employment?

A. fall from L1 to L2
B. fall from L3 to L2
C. rise from L1 to L3
D. rise from L2 to L3",A
39,"What is meant by a four-firm concentration ratio of 25%?

A. The largest four firms’ market share totals 25%.
B. The largest four firms have a market share of 25% each.
C. There are only four firms in the industry.
D. The largest firm has a 25% market share. ",A
40,"A group of producers enter into an agreement to restrict supply or fix the price of a good. What does this describe? 

A. a cartel
B. a conglomerate merger
C. economies of scale
D. horizontal integration",A
41,"What is an external economy of scale? 

A. cheaper costs from purchasing large quantities of inputs
B. decreased interest rates on borrowed funds
C. increased labour productivity
D. relevant training facilities at a local college",D
42,"In a perfectly contestable market, entries and exits are cost-free. In reality, why is this not the case with some firms in contestable markets?  

A. Firms cannot recover all fixed costs if they cease operations.
B. Firms in the industry all operate at the equilibrium level of output.
C. Large firms do not have to increase capital to grow.
D. Multinational companies always benefit from economies of scale. ",A
43,"The table shows a firm’s revenue and costs at different levels of output. What is the firm’s total supernormal profit at the profit-maximising level of output?

A. –15
B. 10
C. 30
D. 120",C
44,"A firm increases its production.   When will this result in allocative efficiency?

A. when the cost of producing the last extra unit equals the value the consumers place on it
B. when the cost of producing the last extra unit is at a minimum
C. when the total cost of production equals the value that consumers place on the total product
D. when the total revenue reaches a maximum",A
45,"Which statement about indifference curves is not correct?

A. Indifference curves are usually convex to the origin of the diagram.
B. Indifference curves can intersect each other.
C. The consumer always prefers a higher indifference curve to a lower one.
D. The slope of the indifference curve represents the marginal rate of substitution.",B
46,"A rational consumer chooses what quantities of two products Y and Z to purchase with a given income.  MUY and MUZ are the additions to total utility that would result if the consumer were to purchase an additional unit of each product.  PY and PZ are the current prices of the two products.  Which outcome would represent consumer equilibrium?

A. when MUY = MUZ
B. when MUY × PY = MUZ × PZ
C. when MUY × PZ = MUZ × PY
D. it is not possible to tell from the information available ",C
47,"What is a likely result of globalisation?

A. Absolute advantage replaces comparative advantage as the basis for trade.
B. Firms’ supply chains are shortened.
C. Trade is less likely to suffer from international economic shocks.
D. There are higher standards of living. ",D
48,"The diagram shows two Lorenz curves.   If the Lorenz curve shifts from L1 to L2, what is least likely to have caused this?

A. Capital gains tax has been reduced.
B. Income tax has been made more progressive.
C. Inheritance tax has been reduced.
D. The tax-free allowance has been decreased for everyone.",B
49,"A US company receives a US$20 million dividend from shares that it owns in a Brazilian company.  How would this dividend be shown in the balance of payments of the United States?

A. a credit in the capital account
B. a credit in the current account
C. a debit in the capital account
D. a debit in the current account ",B
50,"In 2018, the United States (US) government introduced tariffs on a wide range of imports from China.  Which type of policy was the US government adopting?

A. expenditure-reducing
B. expenditure-switching
C. expansionary monetary
D. contractionary monetary",B
51,"What indicates that a more equal distribution of income has been achieved? 

A. a faster rate of economic growth
B. a higher Human Development Index
C. a lower Gini coefficient
D. a lower tax/GDP ratio",C
52,"The table shows the percentage of labour force unemployed and the rate of inflation in a country over a five-year period.  Which statement about the application of the Phillips curve theory to this country is most supported by the data?

A. The data are entirely consistent with the theory of the Phillips curve.
B. The data prove conclusively that the Phillips curve theory does not operate.
C. The data suggest that no conclusions can be reached about the validity of the Phillips curve theory.
D. The data suggest that the theory of the Phillips curve is correct, though with time lags. ",A
53,"Which argument for lowering income tax rates is always valid?

A. It boosts economic activity.
B. It promotes the incentive to work.
C. It reduces the budget deficit.
D. It reduces the incentive to evade taxes.",D
54,"A government is successful in raising the rate of economic growth. As a result, which other macro-economic aim would it most likely have achieved in the short run?

A. balance of payments surplus
B. higher employment
C. lower inflation
D. stronger exchange rate",B
55,"The diagram shows full employment, national income, and expenditure (AMD). The economy is in equilibrium at J.   What does the distance KL represent? 

A. a deflationary gap
B. a trade deficit
C. an inflationary gap
D. an employment gap",A
56,"A country has increasing productivity and falling unemployment.  What can be concluded from this information?

A. Economic efficiency has increased.
B. Interest rates have increased.
C. Taxation has increased.
D. The labour force has increased.",A
57,"When is the natural rate of unemployment most likely to fall?

A. when there is a decline in the education levels of workers
B. when there is an increase in income tax rates
C. when there is an increase in labour mobility
D. when there is a rise in the rate of state unemployment benefits",C
58,"When buying a car, Salma agrees to pay half of the cost now and the other half in six months time. Which function of money does this illustrate?  

A. divisibility
B. durability
C. standard of deferred payment
D. store of value",C
59,"Countries in South East Asia have some of the highest income inequality in the world.  Which policy could be adopted by governments in South East Asia to reduce income inequality in the short run?

A. Increase the general sales tax /VAT rate on luxury goods.
B. Introduce a minimum wage.
C. Invest heavily in schools and education programmes.
D. Stimulate economic growth through skills and productivity training.",B
60,"A firm operates in a perfectly competitive labour market. The table shows the marginal revenue product (MRP) and marginal cost of labour (MCL) for each additional worker employed by this profit-maximising firm. How many units of labour will this firm employ?

A. 1
B. 2
C. 3
D. 4",C
61,"The diagram shows a firm’s initial marginal revenue product of labour curve (MRP1).   What could cause the curve to shift to MRP2?

A. a fall in the wage rate
B. a fall in the price of the final product
C. a rise in the wage rate
D. a rise in the price of the final product",B
62,"In which situation is the introduction of a minimum wage most likely to raise employment opportunities as well as wages?

A. Firms face intense competition both at home and abroad.
B. Labour costs are a high proportion of the total cost of the firm.
C. The minimum wage is not high enough to lower the profits of the firms.
D. The minimum wage introduced in monopsony is less than the marginal revenue productivity (MRP) of the last worker employed. ",D
63,"What is not a valid comment economists may make regarding the need to subsidise a green energy market that uses solar and wind power? 

A. It is cheaper to use the plentiful supply of coal.
B. Markets will become more efficient.
C. The value of the positive externalities cannot be estimated.
D. The value of the negative externalities cannot be estimated.",B
64,"A smartphone manufacturing company takes over an electronic chip design company.  This is an example of which type of growth?

A. horizontal
B. lateral
C. vertical backwards
D. vertical forwards",C
65,"Firm X is considering whether to co-operate with its rival so that their joint profit is $4000 a month ($2000 each). It calculated that, if it did not co-operate, its own profit would be $2800 a month provided it kept all its customers itself. However, if its rival undercut X’s price and took some of X’s customers then X’s profit would be $1200. It has no knowledge of what the rival’s policy will be.  What describes the situation that the firm is facing?

A. monopoly profit maximisation
B. principal agent problem
C. prisoner’s dilemma
D. satisficing ",C
66,"The diagram shows the marginal private benefit (MPB), the marginal private cost (MPC) and the marginal social cost (MSC) for firms in an industry. The equilibrium price is point X.  What should happen to achieve allocative efficiency?

A. a decrease in consumption and an increase in price
B. a decrease in production and no change in price
C. an increase in consumption and a decrease in production
D. an increase in price and no change in production",A
67,"A bus company has a monopoly and specialises in long-distance travel. It initially sells its tickets to customers one month in advance of the journey. As the departure date approaches, the price of a ticket increases.  Which kind of pricing policy does the bus company operate?

A. minimum pricing
B. predatory pricing
C. price discrimination
D. price leadership",C
68,"The table shows the market shares of firms selling a very similar product in a country between 2018 and 2020.  What can be concluded from the data between the two years?

A. Market concentration increased.
B. Sales of the top four firms fell.
C. Scotsdale and Welshpool’s profits rose.
D. The concentration ratio of the four largest firms fell. ",D
69,"A government makes it compulsory for motorbike riders to wear helmets.  What would represent a positive externality of consumption associated with this decision?

A. decreased pressure on the provision of health care
B. expenses incurred on surveillance of motorbike riders to ensure compliance
C. increased life expectancy of motorbike riders
D. increased profits of helmet manufacturers",A
70,"Which feature of indifference curve theory is most likely to apply in reality?

A. The consumer can express preferences between all possible combinations of goods.
B. The consumer has a limited income to spend.
C. The consumer will always behave rationally.
D. The consumer will always get positive utility from having more of the goods.",B
71,"If consumers aim to maximise their utility, how will they arrange their spending?

A. to obtain the same total utility from each commodity
B. to obtain the same total utility per $ spent on each commodity
C. to obtain the same utility from the last unit of each commodity
D. to obtain the same utility from the last $ spent on each commodity",D
72,"What is most likely to cause the living standards of a country to rise?

A. an increase in the number of doctors
B. an increase in the gold reserves
C. an increase in the number of people per house
D. an increase in the money supply",A
73,"Some conditions for providing foreign aid to low-income countries can be restrictive.  Which kind of aid fits this description?

A. food aid in the event of natural catastrophes such as severe drought
B. grants that are tied to purchasing donor country goods
C. loans that are repaid over a long period at a low rate of interest
D. technical assistance using highly skilled worker transfers to provide support",B
74,"It is often argued that the UN Human Development Index (HDI) is a better indicator of economic development than income per capita because it adjusts for 

A. average hours worked by the population.
B. environmental pollution.
C. inequality in income distribution.
D. life expectancy at birth.",D
75,"Which policy to reduce a current account deficit on the balance of payments could be described as an expenditure-switching policy? 

A. a decrease in government spending
B. a decrease in the exchange rate of the country’s currency
C. an increase in domestic income taxes
D. an increase in domestic interest rates",B
76,"What is most likely to influence subsequent increases in national income as a result of a government policy of reduced interest rates?

A. marginal cost
B. marginal efficiency of capital
C. marginal product
D. marginal utility",B
